{
  "$schema": "../schemas/release.schema.json",
  "version": "1.2.0",
  "target_channels": [
    "dmg",
    "appstore",
    "linux"
  ],
  "created": "2026-01-18",
  "updated": "2026-01-23",
  "git": {
    "tag": "v1.2.0",
    "commit": "55fd96bc898cb78ccd7667460fc221e9a1fe3f09",
    "branch": "main"
  },
  "phases": {
    "pre_release": {
      "status": "pending",
      "completed_at": null,
      "validation": {
        "tests_passed": null,
        "test_count": null,
        "warnings": null,
        "working_directory_clean": null
      }
    },
    "build": {
      "status": "pending",
      "dmg": {
        "built": false,
        "path": null,
        "sha256": null,
        "size_bytes": null,
        "signed": false,
        "notarized": false,
        "sparkle_signature": null,
        "shipped": true,
        "shipped_at": "2026-01-23"
      },
      "appstore": {
        "archived": false,
        "archive_path": null,
        "build_number": 1,
        "exported": false,
        "uploaded": false,
        "upload_receipt": null
      },
      "linux": {
        "built": false,
        "shipped": false,
        "shipped_at": null,
        "github_release_url": null,
        "x86_64": {
          "built": false,
          "path": null,
          "sha256": null,
          "size_bytes": null
        },
        "arm64": {
          "built": false,
          "path": null,
          "sha256": null,
          "size_bytes": null
        }
      }
    },
    "review_materials": {
      "status": "pending",
      "demo_video": {
        "recorded": false,
        "path": null,
        "deployed": false
      },
      "sample_data": {
        "generated": false,
        "path": null,
        "deployed": false
      }
    },
    "submission": {
      "status": "approved",
      "submitted_at": null,
      "rejection": null,
      "resubmission": null,
      "approved_at": "2026-01-23"
    },
    "marketing": {
      "status": "pending",
      "changelog": {
        "written": false,
        "published": false
      },
      "announcements": {
        "twitter": false,
        "mastodon": false,
        "hacker_news": false,
        "product_hunt": false
      }
    },
    "post_release": {
      "status": "pending",
      "documentation_updated": false,
      "support_faq_updated": false,
      "monitoring_enabled": false
    }
  },
  "notes": [
    {
      "date": "2026-01-18",
      "author": "system",
      "note": "Release initialized"
    },
    {
      "date": "2026-01-23",
      "author": "system",
      "note": "appstore marked as approved (guard bypassed)"
    },
    {
      "date": "2026-01-23",
      "author": "system",
      "note": "dmg marked as shipped (guard bypassed)"
    }
  ]
}